[
  {
    "id": "f2d6252a-93d6-4e06-b605-9ff7083567ec",
    "name": "Aurora Complex",
    "description": "A vast and elegant living space",
    "coords": [
      1310.3811968550115,
      475.8423271158599,
      1219.7450626553496,
      545.7396848461076,
      1255.8458957687742,
      596.0504203552418,
      1356.851418203143,
      518.0879828868887
    ],
    "type": "complex"
  },
  {
    "id": "7764e48d-1174-4270-a92e-667d74b20e18",
    "name": "Misr University",
    "category": "education",
    "description": "Misr University",
    "distanceK": 2,
    "timeMin": 4,
    "coords": {
      "x": 1360.8334842097925,
      "y": 310.0133051978145
    },
    "type": "poi",
    "path": [
      1285.7058933705696,
      533.9301038010245,
      1367.7366373715302,
      467.97993279847213,
      1331.3579807540484,
      427.8106289914209,
      1600.4135918265288,
      222.46243847173469,
      1521.2432051201438,
      125.97352967332792,
      1322.080201061894,
      269.4698555786508,
      1360.8334842097925,
      310.0133051978145
    ],
    "pathStyle": {
      "stroke": "#ff0000",
      "strokeWidth": 6
    }
  },
  {
    "id": "7b3a761c-27b0-4764-be6e-f1d66f06d34e",
    "name": "Misr Hospital",
    "category": "healthcare",
    "description": "Misr Hospital",
    "distanceK": 2,
    "timeMin": 3,
    "coords": {
      "x": 1601.715942061618,
      "y": 778.1946236541825
    },
    "type": "poi",
    "path": [
      1285.7058933705696,
      533.9301038010245,
      1364.020094900955,
      466.32887768001564,
      1697.259127887795,
      769.1335042972698,
      1671.0917175213617,
      793.9817082508516,
      1628.2828049844684,
      756.1122856220616,
      1601.715942061618,
      778.1946236541825
    ],
    "pathStyle": {
      "stroke": "#85008f",
      "strokeWidth": 6
    }
  },
  {
    "id": "a98631da-912f-4c5d-81c2-43ff08b6fc80",
    "name": "Monorail Station",
    "category": "transport",
    "description": "Monorail Station",
    "distanceK": 5,
    "timeMin": 8,
    "coords": {
      "x": 840.1289230639288,
      "y": 936.6699248724889
    },
    "type": "poi",
    "path": [
      1285.7058933705696,
      533.9301038010245,
      1365.6685863971882,
      466.0679743387373,
      1245.826870950194,
      339.94948173631246,
      1334.0602426916182,
      270.24805321270804,
      1320.5652904121207,
      259.56454932477254,
      990.0085706292899,
      512.3159819873422,
      963.4741091532718,
      533.962516349357,
      956.1422184822668,
      555.958188362372,
      940.0818865362558,
      669.4279249374493,
      938.6853359322548,
      697.0097993664681,
      948.8103278112617,
      718.3071960774827,
      966.9654856632741,
      752.522685875506,
      972.5516880792779,
      772.7726696335199,
      958.5861820392684,
      795.117479297535,
      812.9957815721692,
      903.3501511076088,
      840.1289230639288,
      936.6699248724889
    ],
    "pathStyle": {
      "stroke": "#006eff",
      "strokeWidth": 6
    }
  },
  {
    "id": "b8d461bc-f2d6-4e89-9e12-72464dc200f3",
    "name": "Shooting Club",
    "category": "recreation",
    "description": "Shooting Club",
    "distanceK": 4,
    "timeMin": 3,
    "coords": {
      "x": 902.67323941887,
      "y": 223.6136187819762
    },
    "type": "poi",
    "path": [
      1285.7058933705696,
      533.9301038010245,
      1362.9934470288645,
      467.1911277415248,
      1245.3331249043367,
      337.83358061046505,
      1332.7182764237227,
      271.77866292651964,
      1321.0210514171908,
      256.64107762394883,
      1065.9965254726405,
      453.6798945788996,
      979.6747580447575,
      332.329004136803,
      947.7732352996702,
      354.8477260745117,
      873.3363488944666,
      256.0155575701237,
      902.67323941887,
      223.6136187819762
    ],
    "pathStyle": {
      "stroke": "#5a39fe",
      "strokeWidth": 6
    }
  }
]